<?xml version="1.0" encoding="UTF-8"?>
<column_info xmlns:xsi="http://www.w3.org/2001/XMLSchema-instance" xmlns="SanityChecker_ColumnInfo" xmlns:dup="SanityChecker_ColumnInfo" xsi:schemaLocation="SanityChecker_ColumnInfo SanityChecker_ColumnInfo.xsd">
  <socat_column name="latitude">
    <input_column index="4">Lat(degN)</input_column>
    <input_units>decimal_degrees</input_units>
  </socat_column>
  <socat_column name="longitude">
    <input_column index="5">Lon(degE)</input_column>
    <input_units>decimal_degrees</input_units>
  </socat_column>
  <socat_column name="temp">
    <input_column index="6">Tss(degC)</input_column>
    <input_units>degC</input_units>
  </socat_column>
  <socat_column name="temperature_equi">
    <input_column index="7">Equilibrator Temperature(degC)</input_column>
    <input_units>degC</input_units>
  </socat_column>
  <socat_column name="sal">
    <input_column index="8">Sal.</input_column>
    <input_units>psu</input_units>
  </socat_column>
  <socat_column name="pressure_equi">
    <input_column index="9">EquilibratorPressure(hPa)</input_column>
    <input_units>hPa</input_units>
  </socat_column>
  <socat_column name="xco2water_eq_dry">
    <input_column index="10">X(CO2)w(ppm)</input_column>
    <input_units>ppm</input_units>
  </socat_column>
  <socat_column name="fco2water_sst_wet">
    <input_column index="11">fCO2w(uatm)</input_column>
    <input_units>uatm</input_units>
  </socat_column>
  <socat_column name="xco2air_dry">
    <input_column index="12">X(CO2)a(ppm)</input_column>
    <input_units>ppm</input_units>
  </socat_column>
  <socat_column name="fco2air_wet">
    <input_column index="13">fCO2a(uatm)</input_column>
    <input_units>uatm</input_units>
  </socat_column>
  <date_columns>
    <date index="2">Date(UTC)</date>
    <time index="3">Time(UTC)</time>
  </date_columns>
</column_info>
